Item,Amount,Value
غاز طبيعى فى صوره سائله,107.0,مليون دولار
سماد يوريا أو اسمده ازوتيه اخرى,32.5,مليون دولار
زيوت نفط خفيفه وزيوت خفيفه اخرى متحصل عليها من المواد المعدنيه,22.2,مليون دولار
كحول الميثيل,10.6,مليون دولار
اجهزة كهربائيه للتسخين الفورى للمياه ومقاومات تسخين كهربائيه (سخانات مغموره بداخل الغسالات),7.3,مليون دولار
مجموعات اسلاك الاشعال ومجموعات اسلاك اخرى من النوع المستعمل فى السيارات الطائرات او السفن,6.6,مليون دولار
كابلات كوكشال نحاسية ضغط عالى ومنخفض ومتوسط دون تحديد لخامه التغليف او الضغوط,6.4,مليون دولار
أحجار طبيعيه للمبانى مصقوله,3.7,مليون دولار
مفاتيح كهربائيه اخرى للأكثر من 1000 فولت,3.3,مليون دولار
اجهزة كهربائيه حراريه اخرى,3.3,مليون دولار
بولى اثيلين ذات ثقل نوعى 94ر او يزيد,3.1,مليون دولار
"الواح , افرخ , رقائق , شرائط ,شرائح,غير خلوية وغير مقواه بوليمييرات البروبيلين",2.6,مليون دولار
كحوليات بتركيز أكثر من 80%,2.4,مليون دولار
,2.3,مليون دولار
ملايات سرير من ألياف نسجيه مخلوطه,2.3,مليون دولار
حمامات و بانيوهات و أحواض من البلاستيك,2.1,مليون دولار
لوحات توزيع كهرباء بدون تحديد,1.9,مليون دولار
منصهرات كهربيه داتيه لا يزيد عن 1000 فولت,1.9,مليون دولار
قضبان ?  زوايا و اشكال خاصه اخرى من المونيوم,1.6,مليون دولار
قدد من الالومنيوم مستطيلة الشكل,1.6,مليون دولار
زيوت النعناع الأخرى,1.5,مليون دولار
,1.4,مليون دولار
زيوت عطرية أخرى,1.2,مليون دولار
تى شيرت وفانلات بنصف اكمام من القطن مصنره,1.1,مليون دولار
ملايات السرير أخرى,1.0,مليون دولار
غيرها من الياف زجاجيه (بما فيها الصوف الزجاجى) واصناف منها,1.0,مليون دولار
حبات  (P.P) بولي بروبلين,991.5,ألف دولار
فراوله محفوظه مؤقتا,904.8,ألف دولار
محضرات واصناف صيدليه اخر,902.3,ألف دولار
خضروات اخرى مجمده,862.6,ألف دولار
موصلات كهربيه لا تزيد عن 80 فولت,749.1,ألف دولار
إطارات السيارات النقل و الشاحنات,730.2,ألف دولار
اطقم حمامات / بياضات متنوعه,684.8,ألف دولار
فضلات وصلات الومنيوم,668.7,ألف دولار
فاصولياخضراء و فول أخضر,651.3,ألف دولار
أغطية أرضيات نسجيه أخرى,624.1,ألف دولار
خيوط من البوليستر المستمر غير مسرح أو ممشط,532.5,ألف دولار
بودره بولي فنيل كلوريد  P.V.S,517.5,ألف دولار
مستلزمات أخرى من أنواع البلاستيك الأخرى,515.6,ألف دولار
سجاد وغيره من اغطية الارضيات النسجية من حرير أو قطن أو ألياف صناعيه عقدى,474.4,ألف دولار
بازلياء خضراء,472.4,ألف دولار
زيوت عطريه (من موالح) متعدده,462.0,ألف دولار
بطاطا طازجه أو مجففه,460.0,ألف دولار
غيرها من مصنوعات اخرى من حديد او صلب,436.7,ألف دولار
نباتات طبيه أخرى,430.3,ألف دولار
بودره بولي ايثلين P.E.T,406.5,ألف دولار
مخاليط خضروات مجمده,395.5,ألف دولار
<او=80درجه,395.4,ألف دولار
غيرها من منشات واجزاوءها من حديد او صلب,377.2,ألف دولار
أحجار طبيعيه للمبانى من الألبستر و الرخام,376.4,ألف دولار
دفاتر),347.3,ألف دولار
كبريتات ماغنيسيوم,335.6,ألف دولار
ليتوبون والوان سطحية ومحضرات اخرى غير عضويه متنوعه,324.4,ألف دولار
سليب أو بريف من القطن غير مصنره,306.6,ألف دولار
برتقال طازج أو مجفف,304.7,ألف دولار
اجزاء الات كهربائيه حراريه,284.0,ألف دولار
اثاث معدنى اخر,258.4,ألف دولار
قمصان نوم وبيجامات حريمى من القطن غير مصنره,244.9,ألف دولار
يوسفى طازج أو مجفف,224.4,ألف دولار
زيوت عطرية مركزة فى شكل عجائن عطرية,211.7,ألف دولار
ادوات للمائدة والمطبخ بورسلين,207.4,ألف دولار
طرشى),201.4,ألف دولار
جوز و لوز محلى,200.6,ألف دولار
فراوله طازجه,200.0,ألف دولار
بنطلون رجالى من الياف نسجيه أخرى مصنره,192.9,ألف دولار
غزل قطن متعدد أكثر من 85% قطن ممشط (31و192) (56و232)غير مهييء للبيع بالتجزئه,184.9,ألف دولار
اسمنت فوندو ..... الخ,179.8,ألف دولار
سجاد نايلون آخر,171.1,ألف دولار
ضمادات لاصقة واصناف اخرى ذات طبقة لاصقة,166.3,ألف دولار
أدوات المدارس و المكاتب من أنواع البلاستيك الأخرى,165.6,ألف دولار
قمصان رجالى من الياف صناعيه غير مصنره,163.7,ألف دولار
مصنوعات اخري من بورسلين او صيني للزينه,162.3,ألف دولار
تى شيرت وفانلات بنصف اكمام من الياف أخرى مصنره,158.2,ألف دولار
أجزاء داخل الطائرات,153.7,ألف دولار
ملايات قطن مطبوعة,151.7,ألف دولار
اجهزه طبخ واجهزه تسخين تعمل بالغاز او تعمل بالغاز ونوع اخر من الوقود,150.3,ألف دولار
فواكه ?  اثمار محفوظه مؤقتا,148.8,ألف دولار
ادوات أخرى من الزجاج العادى,135.5,ألف دولار
خضروات بقليه اخرى,135.0,ألف دولار
قوارب وزوارق تجديف منفوخه,124.8,ألف دولار
فيروسيليكون سبيكه 55%,119.7,ألف دولار
توابل بشكل مخاليط (بهارات),118.8,ألف دولار
قياس الضغط السائلى,117.6,ألف دولار
روب حريمى من الالياف النسجية الأخرى غير مصنره,111.7,ألف دولار
قمصان رجالى من الياف أخرى غير مصنره,111.6,ألف دولار
ملابس المطر الداخليه رجالى بصفة عامه,96.7,ألف دولار
بياضات المائدة وبياضات المطابخ من المناشف او الاقمشة الوبرية المماثلة من قطن,90.4,ألف دولار
كتالوجات تجاريه وماشابه (طباعه اعلانات دعايه وملصقات),88.1,ألف دولار
راتنجات عطرية,85.0,ألف دولار
غزل كتان مفرد,79.8,ألف دولار
آلات تحميل و تفريغ البضائع,77.2,ألف دولار
بذور سمسم,75.5,ألف دولار
بصل وكرات بشوشه,70.4,ألف دولار
سجادوغيره من اغطيه الارضيات النسجيه من مواد نسجيه تركيبيه اواصطناعيه,64.8,ألف دولار
خضروات مجففه,61.9,ألف دولار
وبريات / فوط وبشاكير من القطن,61.9,ألف دولار
بنطلون رجالى من الياف صناعيه غير مصنره,59.1,ألف دولار
شحوم نباتيه,58.8,ألف دولار
ثـــوم طازج أو مثلج,58.0,ألف دولار
وصلات و كيعان و فلانشات لمواسير,57.7,ألف دولار
ملفات صندوقية /اكلاسيرات صندوقيه,53.8,ألف دولار
طقم رجالى من الياف نسجيه أخرى غير مصنره,53.8,ألف دولار
كوريك رفع للسيارات,53.2,ألف دولار
بهارات اخرى,52.4,ألف دولار
الواح/افرخ/رقائق/شرائط/شرائح/اشكال مسطحه من البوليستر,52.2,ألف دولار
أجهزة تقدير مسافات,50.0,ألف دولار
زيتون مخلل,47.1,ألف دولار
"غيرها من الواح , افرخ , رقائق,شرائط,شرائح من البلاستيك",46.4,ألف دولار
فستان حريمى من القطن غير مصنره,46.3,ألف دولار
"غيرها من الواح , افرخ , رقائق,شرائط,شرائح من بوليمرات البوليفينيل",45.6,ألف دولار
قطع من ملابس جاهزه,45.5,ألف دولار
عصير خليط,45.4,ألف دولار
حساء ومرق ومحضرات (شوربه),44.7,ألف دولار
ملابس أخرى من أقمشه نسجيه أخرى حريمى,43.8,ألف دولار
بنسلين للبيع بالتجزئه,38.8,ألف دولار
بدل حريمى من القطن غير مصنره,37.3,ألف دولار
الواح/افرخ/رقائق/شرائط/شرائح/اشكال مسطحه من بوليمرات الاكريليك المركبه,37.2,ألف دولار
كلف دانتيل ? أقمشه دانتيل من القطن,36.5,ألف دولار
"اجزاء الات اخرى لعمل عجينةالورق,الورق اوالكرتون,بما فيهاالات القطع من جميع الانواع",34.1,ألف دولار
مضخات تستخدم نظم تجديد الإستخدام,33.6,ألف دولار
عربات أطفال و زجاجات برطمانات من أنواع البلاستيك الأخرى,33.4,ألف دولار
مانجوستين طازجةاو مجففه,32.5,ألف دولار
لوحات توزيع كهرباء لفولت يزيد عن 1000 فولت  للمصانع,32.1,ألف دولار
الواح رخام بدون صقل,29.2,ألف دولار
غيرها من ادوات واجهزة اخرى للتنظيم او التحكم,29.2,ألف دولار
فاصوليا حمراء مجففه ومفصصه ومعبأه,28.2,ألف دولار
غراء قاعدته نشاء او دكسترين او انواع اخرى من نشويات معدلة,26.7,ألف دولار
اثاث اخر من الخشب ? حجره سفره من خشب,26.1,ألف دولار
سماد كبريتات البوتاسيوم فى عبوات أكثر من 10 كج,25.8,ألف دولار
فستان حريمى من الياف صناعيه غير مصنره,24.9,ألف دولار
مسمار من حديد او صلب,20.6,ألف دولار
فول بقلى (فول خيل),20.5,ألف دولار
بنطلون حريمى من القطن غير مصنره,17.9,ألف دولار
منتجات اخرى من اصل نباتى,17.0,ألف دولار
روب حريمى من القطن غير مصنره,15.8,ألف دولار
سجاد من ألياف صناعيه أخرى,14.4,ألف دولار
خبز الجنزبيل و مشبهاته,13.3,ألف دولار
طبول ?  اكسيلفون ?  صاجات,12.8,ألف دولار
ومحافظ من ورق وورق مقوى غير مضلع قابله للطى,12.5,ألف دولار
ملابس مصنوعه من أنسجه معالجه ضد الرطوبه,12.2,ألف دولار
غيرها من الادوات والاجهزة المستخدمة فى الطب او الجراحة او لطب الاسنان  او للطب البيطرى,12.0,ألف دولار
خضروات أخرى محفوظه مؤقتا وغير صالحه للاستهلاك المباشر,11.7,ألف دولار
قوارير وزجاجات واوانى وجرار وامبولات وغيرها من الاوعية من الزجاج من النوع المستعمل فى نقل اوتعبئة السلع,9.6,ألف دولار
بنطلون حريمى من الياف نسجيه أخرى غير مصنره,9.1,ألف دولار
شعر كتان مسرح أو شعر كتان ممشط و ليس مغزول,8.8,ألف دولار
زجاج سيارات سيكوريت,8.6,ألف دولار
قمصان نوم وبيجامات حريمى من الالياف النسجية الأخرى غير مصنره,8.0,ألف دولار
مخلفات صناعات البنجر,7.5,ألف دولار
غزل قطن متعدد أكثر من 85% قطن ممشط (31و192) ( 125)غير مهييء للبيع بالتجزئه,6.9,ألف دولار
منصهرات كهربيه لا يزيد عن 1000 فولت,6.4,ألف دولار
قطعه أدوات المائده غير مطليه بمعادن ثمينه,6.1,ألف دولار
موزايكو),6.1,ألف دولار
عصائر خضار أو فواكه أخرى,5.7,ألف دولار
بدل حريمى من الصوف غير مصنره,5.6,ألف دولار
قنينة كانيولا وادوات مماثلة,5.1,ألف دولار
إكسسوارات الأثاث من أنواع البلاستيك الأخرى,4.6,ألف دولار
خضروات مجمدة او مبردة,4.5,ألف دولار
أجزاء ميكروسكوبات,3.7,ألف دولار
غيرها من زيوت ودهون نباتيه ومايتجزأ عنها,3.7,ألف دولار
بلوزه حريمى من الياف نسجيه أخرى غير مصنره,3.2,ألف دولار
قطع غيار متنوعه من الكاوتشوك,3.1,ألف دولار
مطبوعات أخرى,2.8,ألف دولار
عصصارات الفواكه والخضروات,2.7,ألف دولار
أحذية التزحلق على الماء,2.5,ألف دولار
سيراميك الأفران,2.5,ألف دولار
فوليه),2.5,ألف دولار
كتب و كتيبات مطبوعه وان كانت مصوره,2.5,ألف دولار
ملابس المطر الداخليه حريمى بصفة عامه,2.2,ألف دولار
كتيبات فى صفحات متفرقة .. وان كانت مطوية .اجزاء دون تحديد..,2.1,ألف دولار
بطاطس غير مجمده محفوظه اومعلبه,1.5,ألف دولار
قرنبيــط,1.5,ألف دولار
أجهزه للتحليل الطبيعى و الكيميائى,1.1,ألف دولار
وحدات تخزين البيانات للحاسب الالى,1.1,ألف دولار
أجهزه للتحليل بإستخدام الإشعاع,1.0,ألف دولار
اجزاء من اجهزة اخرى من مدافىء ومواقد طهى,1.0,ألف دولار
جوايط,0.9,ألف دولار
وحدات مغناطيسية او بصرية لقراءة البيانات ونسخها على وسائط بيانات مكودة,0.8,ألف دولار
محولات ساكنة مثل مقومات التيار,0.8,ألف دولار
التروس والتعشيقات (ترس بدون تعشيق),0.6,ألف دولار
حلى غواية تقليدية اخرى,0.5,ألف دولار
أقمشه تحتوى على 85% بوليستر مستمره أخرى,0.5,ألف دولار
مستحضرات اخرى ذات رائحة يظهر اثرها بالحرق / للطقوس الدينية مثل البخور,0.5,ألف دولار
أجزاء من مصابيح و إضائه زجاجيه,0.5,ألف دولار
حقائب بسطح خارجى من مواد اخرى,0.4,ألف دولار
آلات قولبة أو تشكيل المطاط أو البلاستيك,0.3,ألف دولار
"صور ,تصميمات,وصور فوتوغرافية",0.3,ألف دولار
غيرها من المستلزمات المعدنيه الأخرى,0.3,ألف دولار
جبن طازج أبيض بدون أى عمليات لاحقه,0.3,ألف دولار
جاكت رجالى من الياف صناعيه غير مصنره,0.3,ألف دولار
محضرات صبغية من التيتانيوم,0.3,ألف دولار
اثاث معدنى من النوع المستخدم فىالمكاتب,0.2,ألف دولار
نجف و ثرايا كريستال و غيرها,0.1,ألف دولار
قصب سكر,0.1,ألف دولار
سحلب مطحون,0.1,ألف دولار
مصابيح وتركيبات اضاءه غير كهربائيه,0.1,ألف دولار
ستائر و بانيهات من أنواع البلاستيك الأخرى,0.1,ألف دولار
فرنشات,0.1,ألف دولار
عداد الغاز الكبيعى,0.1,ألف دولار
حاسب الى رقمى على الاقل وحدة معالجة بيانات واحدة ووحدة ادخال بيانات واحدة عدا الاقل من 10كج,0.0,ألف دولار
تابلوهات فنيه,0.0,ألف دولار
ورق كرافت لينر فى رولات غير مغلف أو معالج أو مبيض,0.0,ألف دولار
أنسولين للتجزئه,0.0,ألف دولار
اكسوارات عوازل كهربائيه من بلاستيك,0.0,ألف دولار
