Item,Amount,Value
عيدان قضبان ?  اشكال خاصة ?  اسلاك نصف مشغولة من ذهب,89.0,مليون دولار
خام أو بودرة الذهب,15.5,مليون دولار
ألواح حديد زنك مسحوبه على الساخن فى رولات بعرض أكبر من 600 مم أخرى,10.5,مليون دولار
قوارير وزجاجات واوانى وجرار وامبولات وغيرها من الاوعية من الزجاج من النوع المستعمل فى نقل اوتعبئة السلع,1.7,مليون دولار
ملح غير صالح للطعام و ملح طعام,1.1,مليون دولار
سجاد وغيره من اغطية الارضيات النسجية من حرير أو قطن أو ألياف صناعيه عقدى,812.6,ألف دولار
بنطلون رجالى من القطن غير مصنره,675.6,ألف دولار
بنطلون رجالى من الياف صناعيه غير مصنره,546.9,ألف دولار
قمصان رجالى من الياف أخرى غير مصنره,367.4,ألف دولار
نباتات طبيه أخرى,299.2,ألف دولار
الواح/افرخ/رقائق/شرائط/شرائح/اشكال مسطحه من البوليستر,298.3,ألف دولار
ملابس المطر الداخليه رجالى بصفة عامه,280.0,ألف دولار
طرشى),271.4,ألف دولار
تى شيرت وفانلات بنصف اكمام من الياف أخرى مصنره,270.2,ألف دولار
بياضات المائدة وبياضات المطابخ من المناشف او الاقمشة الوبرية المماثلة من قطن,266.0,ألف دولار
بنطلون حريمى من الياف صناعيه غير مصنره,262.4,ألف دولار
قوالب شيكولاته,249.4,ألف دولار
فراوله محفوظه مؤقتا,221.2,ألف دولار
خميره جافه نشطه,221.0,ألف دولار
زيتون مخلل,214.2,ألف دولار
أغطية أرضيات نسجيه أخرى,206.3,ألف دولار
بويات و ورنيش من قاعده  بوليمرات,204.7,ألف دولار
ملايات سرير من ألياف نسجيه مخلوطه,200.3,ألف دولار
وبريات / فوط وبشاكير من القطن غير مبيضه,199.5,ألف دولار
مخاليط خضروات مجمده,197.8,ألف دولار
قمصان رجالى من الياف صناعيه غير مصنره,197.5,ألف دولار
غيرها من منشات واجزاوءها من حديد او صلب,188.6,ألف دولار
برتقال طازج أو مجفف,182.0,ألف دولار
خضروات اخرى مجمده,181.8,ألف دولار
بنطلون رجالى من الياف نسجيه أخرى غير مصنره,179.5,ألف دولار
قطع من ملابس جاهزه,154.9,ألف دولار
بنطلون رجالى من الياف نسجيه أخرى مصنره,149.5,ألف دولار
زجاج مسطح عادى سادة غير مسلح,140.8,ألف دولار
بصل مجفف,134.6,ألف دولار
مساحيق محضره للخبيز (بيكنج بودر),130.2,ألف دولار
تى شيرت وفانلات بنصف اكمام من القطن مصنره,118.6,ألف دولار
قضبان ?  زوايا و اشكال خاصه اخرى من المونيوم,117.5,ألف دولار
فاكهه أخرى طازجه,111.4,ألف دولار
سليب رجالى من ألياف نسجيه أخرى غير مصنره,110.7,ألف دولار
عصير خليط,109.9,ألف دولار
سماد كبريتات البوتاسيوم فى عبوات أكثر من 10 كج,99.4,ألف دولار
بنطلون حريمى من القطن غير مصنره,94.8,ألف دولار
فراجين اسطوانيه للطلاء,93.7,ألف دولار
"الواح , افرخ , رقائق , شرائط ,شرائح,غير خلوية وغير مقواه بوليمييرات البروبيلين",87.1,ألف دولار
غيرها من المربى,82.2,ألف دولار
ملابس أخرى من أقمشه نسجيه أخرى رجالى,80.2,ألف دولار
شرائح غير خلويه ولامتحده مع مواد اخرى من بوليميرات الايثيلين,75.4,ألف دولار
حساء ومرق ومحضرات (شوربه),73.7,ألف دولار
غواسل عضوية بحالة ايونات سالبة,67.7,ألف دولار
مانجوستين طازجةاو مجففه,61.0,ألف دولار
ادوات أخرى من الزجاج العادى,56.0,ألف دولار
مستلزمات أخرى من أنواع البلاستيك الأخرى,52.2,ألف دولار
ادوات للمائدة والمطبخ بورسلين,52.2,ألف دولار
خلاصات او ارواح او مركزات من بن او على اساس من البن,51.7,ألف دولار
اطقم حمامات / بياضات متنوعه,45.6,ألف دولار
راتنجات الكيديه,41.3,ألف دولار
بلوزه حريمى من الياف صناعيه غير مصنره,40.1,ألف دولار
دقيق و مغذيات من حبوب زيتيه أخرى,34.6,ألف دولار
انواع جبنه اخرى,32.4,ألف دولار
سليب رجالى من ألياف صناعيه غير مصنره,32.1,ألف دولار
اثاث من لدائن اصطناعيه,30.6,ألف دولار
فراوله طازجه,23.8,ألف دولار
صناديق و حاويات من البلاستيك,22.9,ألف دولار
نسج قطيفة شينيل من الياف تركيبية,22.8,ألف دولار
جاكت حريمى من الصوف مصنره,21.6,ألف دولار
خلاصات او ارواح او مركزات من بن,20.8,ألف دولار
مرايا زجاجيه بدون اطر,20.5,ألف دولار
خضروات أخرى محفوظه مؤقتا وغير صالحه للاستهلاك المباشر,19.0,ألف دولار
اوعيه لتعبئه الغازات المضغوطه او المسيله,18.6,ألف دولار
قمصان رجالى من الياف أخرى مصنره,14.4,ألف دولار
اسمنت فوندو ..... الخ,13.7,ألف دولار
جاكت حريمى من الياف صناعيه غير مصنره,12.9,ألف دولار
بلوزه حريمى من القطن غير مصنره,12.1,ألف دولار
أجزاء كاميرات,12.0,ألف دولار
فول بقلى (فول خيل),11.0,ألف دولار
خضروات مجففه,10.9,ألف دولار
اغذيه متحصل عليها من نفش اوتحميص الغلال,9.0,ألف دولار
اثاث اخر من الخشب ? حجره سفره من خشب,7.2,ألف دولار
سليب رجالى قطن غير مصنره,5.3,ألف دولار
البسه اطفال وملحقاتها مصنرة او كروشيه من قطن مصنره,4.7,ألف دولار
منتجات اخرى من اصل نباتى,4.5,ألف دولار
أسماك أخرى مجففه سواء مملحه أو غير مملحه,4.4,ألف دولار
جوارب حريمى طويله أخرى من الياف نسجيه أخرى,4.0,ألف دولار
فلفل  رومى أخضر و ألوان أخرى,4.0,ألف دولار
محضرات غذائيه اخرى,2.9,ألف دولار
اسماك محضرةاومحفوظة,2.9,ألف دولار
بلوفرات من الياف صناعية اكريلك مصنره,2.6,ألف دولار
اصناف اخرى من مصنوعات من جبس او من مكونات اساسها الجبس,2.4,ألف دولار
توســت أو خبز محمص,2.3,ألف دولار
بلوزه حريمى من الياف نسجيه أخرى مصنره,2.3,ألف دولار
زيوت عطرية مركزة فى شكل عجائن عطرية,2.2,ألف دولار
حلى غواية تقليدية اخرى,2.2,ألف دولار
بلح طازج أو مجفف,2.1,ألف دولار
أجهزة تقدير مسافات,2.0,ألف دولار
مولاس قصب السكر و عسل اسود,1.8,ألف دولار
بسكويت صيدلى,1.8,ألف دولار
بدل رجالى من ألياف نسجيه أخرى غير مصنره,1.6,ألف دولار
فواكه وثمار اخرى ذات قشره صلبه فى محلول سكرى,1.3,ألف دولار
أكباد السمك مجففه أو مدخنه أو مملحه,1.3,ألف دولار
طماطم محفوظه بكاملها فى مواد أخرى,1.3,ألف دولار
شـاى أسود و شاي خام معبيء فى أكثر من 3 كج,1.2,ألف دولار
قصب سكر,1.1,ألف دولار
بلوزه حريمى من الياف نسجيه أخرى غير مصنره,1.1,ألف دولار
"ادوات من خزف زجاجى من النوع المستعمل للمائدة ,للمطبخ التواليت والمكتب وللتزيين داخل المنازل",1.1,ألف دولار
فاصوليا حمراء مجففه ومفصصه ومعبأه,1.1,ألف دولار
سحلب مطحون,1.0,ألف دولار
خضروات مجمدة او مبردة,1.0,ألف دولار
صلصات ومحضرات مماثله اخرى,0.9,ألف دولار
?  ساده من قطن,0.9,ألف دولار
بطاطس غير مجمده محفوظه اومعلبه,0.9,ألف دولار
لبان بلـــدى,0.8,ألف دولار
طبول ?  اكسيلفون ?  صاجات,0.8,ألف دولار
أجزاء من مصابيح و إضائه زجاجيه,0.7,ألف دولار
قرنبيــط,0.7,ألف دولار
عجائن اخرى غير محتويه على بيض,0.7,ألف دولار
بسله مجمده,0.6,ألف دولار
ملايات و مفارش سرير قطن,0.5,ألف دولار
عدادات كهرباء بريكوردر,0.5,ألف دولار
سبانخ مجمده,0.4,ألف دولار
قواعد مصهرات جهد منخفض (اجهزه اخرى لوقايه الدوائر الكهربائيه),0.4,ألف دولار
بصل وكرات بشوشه,0.3,ألف دولار
أجزاء داخل الطائرات,0.3,ألف دولار
كتب و كتيبات مطبوعه وان كانت مصوره,0.2,ألف دولار
فوط سفرة / بياضات قطن,0.2,ألف دولار
خيـــــار و قثه طازجه,0.2,ألف دولار
صلصه كتش اب و صلصه حريفه (هوت صوص),0.1,ألف دولار
حليات خشبيه بلاستيكيه,0.1,ألف دولار
شمام طازج ما عدا البطيخ,0.1,ألف دولار
خس ملفوف وكرنبى,0.0,ألف دولار
حاسب الى رقمى نظام متكامل,0.0,ألف دولار
خضروات اخرىمحضرةاومحفوظةغيرماكان منها فى خل اوفى حامض خليك غيرمجمده,0.0,ألف دولار
